# tcpdump -n -i eth0

reading from file 0001.pcap, link-type EN10MB (Ethernet)
16:26:35.057706 IP lamp-s-1vcpu-1gb-tor1-01.ssh > CPE688f2e06a423-CM688f2e06a420.cpe.net.cable.rogers.com.54274: Flags [P.], seq 490888695:490888739, ack 2915420395, win 40880, length 44
16:26:35.057882 IP lamp-s-1vcpu-1gb-tor1-01.ssh > CPE688f2e06a423-CM688f2e06a420.cpe.net.cable.rogers.com.54274: Flags [P.], seq 44:152, ack 1, win 40880, length 108
16:26:35.058000 IP lamp-s-1vcpu-1gb-tor1-01.ssh > CPE688f2e06a423-CM688f2e06a420.cpe.net.cable.rogers.com.54274: Flags [P.], seq 152:188, ack 1, win 40880, length 36
16:26:35.065692 IP CPE688f2e06a423-CM688f2e06a420.cpe.net.cable.rogers.com.54274 > lamp-s-1vcpu-1gb-tor1-01.ssh: Flags [.], ack 44, win 63916, length 0
16:26:35.071724 IP CPE688f2e06a423-CM688f2e06a420.cpe.net.cable.rogers.com.54274 > lamp-s-1vcpu-1gb-tor1-01.ssh: Flags [.], ack 188, win 63772, length 0
16:26:36.120057 IP lamp-s-1vcpu-1gb-tor1-01.ssh > 218.92.0.200.61564: Flags [S.], seq 164887738, ack 3462504062, win 28960, options [mss 1460,sackOK,TS val 238690176 ecr 378241549,nop,wscale 7], length 0
16:26:36.975929 IP 218.92.0.200.34366 > lamp-s-1vcpu-1gb-tor1-01.ssh: Flags [S], seq 2660452433, win 29200, options [mss 1460,sackOK,TS val 378244051 ecr 0,nop,wscale 7], length 0
16:26:36.976022 IP lamp-s-1vcpu-1gb-tor1-01.ssh > 218.92.0.200.34366: Flags [S.], seq 1249201122, ack 2660452434, win 28960, options [mss 1460,sackOK,TS val 238691032 ecr 378244051,nop,wscale 7], length 0
16:26:36.984021 IP lamp-s-1vcpu-1gb-tor1-01.ssh > 218.92.0.200.46655: Flags [S.], seq 2022159412, ack 4189715592, win 28960, options [mss 1460,sackOK,TS val 238691040 ecr 378242800,nop,wscale 7], length 0
16:26:37.976030 IP lamp-s-1vcpu-1gb-tor1-01.ssh > 218.92.0.200.34366: Flags [S.], seq 1249201122, ack 2660452434, win 28960, options [mss 1460,sackOK,TS val 238692032 ecr 378244051,nop,wscale 7], length 0
16:26:37.979799 IP 218.92.0.200.34366 > lamp-s-1vcpu-1gb-tor1-01.ssh: Flags [S], seq 2660452433, win 29200, options [mss 1460,sackOK,TS val 378244302 ecr 0,nop,wscale 7], length 0
16:26:37.979841 IP lamp-s-1vcpu-1gb-tor1-01.ssh > 218.92.0.200.34366: Flags [S.], seq 1249201122, ack 2660452434, win 28960, options [mss 1460,sackOK,TS val 238692036 ecr 378244051,nop,wscale 7], length 0
16:26:39.983857 IP 218.92.0.200.34366 > lamp-s-1vcpu-1gb-tor1-01.ssh: Flags [S], seq 2660452433, win 29200, options [mss 1460,sackOK,TS val 378244803 ecr 0,nop,wscale 7], length 0
16:26:39.983938 IP lamp-s-1vcpu-1gb-tor1-01.ssh > 218.92.0.200.34366: Flags [S.], seq 1249201122, ack 2660452434, win 28960, options [mss 1460,sackOK,TS val 238694040 ecr 378244051,nop,wscale 7], length 0
16:26:41.240091 IP lamp-s-1vcpu-1gb-tor1-01.ssh > 218.92.0.200.46655: Flags [S.], seq 2022159412, ack 4189715592, win 28960, options [mss 1460,sackOK,TS val 238695297 ecr 378242800,nop,wscale 7], length 0
16:26:42.008064 IP lamp-s-1vcpu-1gb-tor1-01.ssh > 218.92.0.200.34366: Flags [S.], seq 1249201122, ack 2660452434, win 28960, options [mss 1460,sackOK,TS val 238696065 ecr 378244051,nop,wscale 7], length 0
16:26:44.312044 IP lamp-s-1vcpu-1gb-tor1-01.ssh > 218.92.0.200.61564: Flags [S.], seq 164887738, ack 3462504062, win 28960, options [mss 1460,sackOK,TS val 238698369 ecr 378241549,nop,wscale 7], length 0
16:26:45.080064 IP lamp-s-1vcpu-1gb-tor1-01.ssh > 94.191.52.53.42474: Flags [P.], seq 3255695742:3255696822, ack 232833, win 227, options [nop,nop,TS val 973067553 ecr 2897500872], length 1080
16:26:45.899804 IP lamp-s-1vcpu-1gb-tor1-01.ssh > 94.191.52.53.42474: Flags [F.], seq 1080, ack 1, win 227, options [nop,nop,TS val 973068372 ecr 2897500872], length 0
16:26:46.104076 IP lamp-s-1vcpu-1gb-tor1-01.ssh > 218.92.0.200.34366: Flags [S.], seq 1249201122, ack 2660452434, win 28960, options [mss 1460,sackOK,TS val 238700161 ecr 378244051,nop,wscale 7], length 0
16:26:47.018467 IP 103.59.132.202.33064 > lamp-s-1vcpu-1gb-tor1-01.ssh: Flags [FP.], seq 1068849446:1068849510, ack 3697243909, win 268, options [nop,nop,TS val 1683445462 ecr 1412818161], length 64
16:26:47.018535 IP lamp-s-1vcpu-1gb-tor1-01 > 103.59.132.202: ICMP lamp-s-1vcpu-1gb-tor1-01 tcp port ssh unreachable, length 124
16:26:49.432063 IP lamp-s-1vcpu-1gb-tor1-01.ssh > 218.92.0.200.46655: Flags [S.], seq 2022159412, ack 4189715592, win 28960, options [mss 1460,sackOK,TS val 238703489 ecr 378242800,nop,wscale 7], length 0
16:26:54.296061 IP lamp-s-1vcpu-1gb-tor1-01.ssh > 218.92.0.200.34366: Flags [S.], seq 1249201122, ack 2660452434, win 28960, options [mss 1460,sackOK,TS val 238708353 ecr 378244051,nop,wscale 7], length 0
16:26:55.320050 IP lamp-s-1vcpu-1gb-tor1-01.ssh > 103.59.132.202.33064: Flags [P.], seq 4294967217:1, ack 0, win 236, options [nop,nop,TS val 1412865266 ecr 1683356476], length 80
16:26:55.617248 IP 103.59.132.202.33064 > lamp-s-1vcpu-1gb-tor1-01.ssh: Flags [.], ack 1, win 268, options [nop,nop,TS val 1683454063 ecr 1412865266,nop,nop,sack 1 {4294967217:1}], length 0
16:26:55.617317 IP lamp-s-1vcpu-1gb-tor1-01 > 103.59.132.202: ICMP lamp-s-1vcpu-1gb-tor1-01 tcp port ssh unreachable, length 72
16:27:00.440062 IP lamp-s-1vcpu-1gb-tor1-01.ssh > 218.92.0.200.61564: Flags [S.], seq 164887738, ack 3462504062, win 28960, options [mss 1460,sackOK,TS val 238714497 ecr 378241549,nop,wscale 7], length 0
16:27:05.560049 IP lamp-s-1vcpu-1gb-tor1-01.ssh > 218.92.0.200.46655: Flags [S.], seq 2022159412, ack 4189715592, win 28960, options [mss 1460,sackOK,TS val 238719617 ecr 378242800,nop,wscale 7], length 0
16:27:10.424060 IP lamp-s-1vcpu-1gb-tor1-01.ssh > 218.92.0.200.34366: Flags [S.], seq 1249201122, ack 2660452434, win 28960, options [mss 1460,sackOK,TS val 238724481 ecr 378244051,nop,wscale 7], length 0
16:27:10.679994 ARP, Request who-has _gateway tell lamp-s-1vcpu-1gb-tor1-01, length 28
16:27:10.681212 ARP, Reply _gateway is-at fe:00:00:00:01:01 (oui Unknown), length 46
16:27:15.048793 IP lamp-s-1vcpu-1gb-tor1-01.ssh > 103.59.132.202.33064: Flags [F.], seq 1, ack 0, win 236, options [nop,nop,TS val 1412884995 ecr 1683356476], length 0
16:27:21.395662 IP 185.175.93.78.47618 > lamp-s-1vcpu-1gb-tor1-01.46800: Flags [S], seq 667717318, win 1024, length 0
root@lamp-s-1vcpu-1gb-tor1-01:~#
root@lamp-s-1vcpu-1gb-tor1-01:~# tcpdump -n -i eth0
tcpdump: verbose output suppressed, use -v or -vv for full protocol decode
listening on eth0, link-type EN10MB (Ethernet), capture size 262144 bytes
16:28:37.920215 IP 138.197.159.178.22 > 99.245.77.102.54274: Flags [P.], seq 490897855:490897963, ack 2915422051, win 40880, length 108
16:28:37.920344 IP 138.197.159.178.22 > 99.245.77.102.54274: Flags [P.], seq 108:144, ack 1, win 40880, length 36
16:28:37.920438 IP 138.197.159.178.22 > 99.245.77.102.54274: Flags [P.], seq 144:252, ack 1, win 40880, length 108
16:28:37.920509 IP 138.197.159.178.22 > 99.245.77.102.54274: Flags [P.], seq 252:288, ack 1, win 40880, length 36
16:28:37.920697 IP 138.197.159.178.22 > 99.245.77.102.54274: Flags [P.], seq 288:460, ack 1, win 40880, length 172
16:28:37.920773 IP 138.197.159.178.22 > 99.245.77.102.54274: Flags [P.], seq 460:496, ack 1, win 40880, length 36
16:28:37.934356 IP 99.245.77.102.54274 > 138.197.159.178.22: Flags [.], ack 108, win 63112, length 0
16:28:37.934456 IP 138.197.159.178.22 > 99.245.77.102.54274: Flags [P.], seq 496:1416, ack 1, win 40880, length 920
16:28:37.934491 IP 99.245.77.102.54274 > 138.197.159.178.22: Flags [.], ack 460, win 64240, length 0
16:28:37.934735 IP 138.197.159.178.22 > 99.245.77.102.54274: Flags [P.], seq 1416:1556, ack 1, win 40880, length 140
16:28:37.934847 IP 138.197.159.178.22 > 99.245.77.102.54274: Flags [P.], seq 1556:1592, ack 1, win 40880, length 36
16:28:37.934975 IP 138.197.159.178.22 > 99.245.77.102.54274: Flags [P.], seq 1592:1748, ack 1, win 40880, length 156
16:28:37.935049 IP 138.197.159.178.22 > 99.245.77.102.54274: Flags [P.], seq 1748:1784, ack 1, win 40880, length 36
16:28:37.935164 IP 138.197.159.178.22 > 99.245.77.102.54274: Flags [P.], seq 1784:1924, ack 1, win 40880, length 140
16:28:37.946240 IP 99.245.77.102.54274 > 138.197.159.178.22: Flags [.], ack 1416, win 63284, length 0
16:28:37.946313 IP 138.197.159.178.22 > 99.245.77.102.54274: Flags [P.], seq 1924:2920, ack 1, win 40880, length 996
16:28:37.946599 IP 138.197.159.178.22 > 99.245.77.102.54274: Flags [P.], seq 2920:3060, ack 1, win 40880, length 140
16:28:37.951061 IP 99.245.77.102.54274 > 138.197.159.178.22: Flags [.], ack 1924, win 64240, length 0
16:28:37.951115 IP 138.197.159.178.22 > 99.245.77.102.54274: Flags [P.], seq 3060:3480, ack 1, win 40880, length 420
16:28:37.951301 IP 138.197.159.178.22 > 99.245.77.102.54274: Flags [P.], seq 3480:3620, ack 1, win 40880, length 140
16:28:37.951493 IP 138.197.159.178.22 > 99.245.77.102.54274: Flags [P.], seq 3620:3656, ack 1, win 40880, length 36
16:28:37.951655 IP 138.197.159.178.22 > 99.245.77.102.54274: Flags [P.], seq 3656:3812, ack 1, win 40880, length 156
16:28:37.951772 IP 138.197.159.178.22 > 99.245.77.102.54274: Flags [P.], seq 3812:3848, ack 1, win 40880, length 36
16:28:37.951918 IP 138.197.159.178.22 > 99.245.77.102.54274: Flags [P.], seq 3848:4004, ack 1, win 40880, length 156
16:28:37.958548 IP 99.245.77.102.54274 > 138.197.159.178.22: Flags [.], ack 2920, win 63244, length 0
16:28:37.958621 IP 138.197.159.178.22 > 99.245.77.102.54274: Flags [P.], seq 4004:4808, ack 1, win 40880, length 804
16:28:37.965718 IP 99.245.77.102.54274 > 138.197.159.178.22: Flags [.], ack 3480, win 64240, length 0
16:28:37.965778 IP 138.197.159.178.22 > 99.245.77.102.54274: Flags [P.], seq 4808:5176, ack 1, win 40880, length 368
16:28:37.965967 IP 138.197.159.178.22 > 99.245.77.102.54274: Flags [P.], seq 5176:5316, ack 1, win 40880, length 140
16:28:37.969585 IP 99.245.77.102.54274 > 138.197.159.178.22: Flags [.], ack 4004, win 63716, length 0
16:28:37.969628 IP 138.197.159.178.22 > 99.245.77.102.54274: Flags [P.], seq 5316:5736, ack 1, win 40880, length 420
16:28:37.969810 IP 138.197.159.178.22 > 99.245.77.102.54274: Flags [P.], seq 5736:5876, ack 1, win 40880, length 140
16:28:37.969952 IP 138.197.159.178.22 > 99.245.77.102.54274: Flags [P.], seq 5876:5912, ack 1, win 40880, length 36
16:28:37.970106 IP 138.197.159.178.22 > 99.245.77.102.54274: Flags [P.], seq 5912:6068, ack 1, win 40880, length 156
16:28:37.970215 IP 138.197.159.178.22 > 99.245.77.102.54274: Flags [P.], seq 6068:6104, ack 1, win 40880, length 36
16:28:37.976340 IP 99.245.77.102.54274 > 138.197.159.178.22: Flags [.], ack 4808, win 62912, length 0
16:28:37.976398 IP 138.197.159.178.22 > 99.245.77.102.54274: Flags [P.], seq 6104:6872, ack 1, win 40880, length 768
16:28:37.980951 IP 99.245.77.102.54274 > 138.197.159.178.22: Flags [.], ack 5316, win 64240, length 0
16:28:37.981001 IP 138.197.159.178.22 > 99.245.77.102.54274: Flags [P.], seq 6872:7240, ack 1, win 40880, length 368
16:28:37.981027 IP 99.245.77.102.54274 > 138.197.159.178.22: Flags [.], ack 6104, win 63452, length 0
16:28:37.981182 IP 138.197.159.178.22 > 99.245.77.102.54274: Flags [P.], seq 7240:7380, ack 1, win 40880, length 140
16:28:37.981269 IP 138.197.159.178.22 > 99.245.77.102.54274: Flags [P.], seq 7380:7416, ack 1, win 40880, length 36
16:28:37.981406 IP 138.197.159.178.22 > 99.245.77.102.54274: Flags [P.], seq 7416:7572, ack 1, win 40880, length 156
16:28:37.981662 IP 138.197.159.178.22 > 99.245.77.102.54274: Flags [P.], seq 7572:7832, ack 1, win 40880, length 260
16:28:37.981905 IP 138.197.159.178.22 > 99.245.77.102.54274: Flags [P.], seq 7832:8228, ack 1, win 40880, length 396
16:28:37.982028 IP 138.197.159.178.22 > 99.245.77.102.54274: Flags [P.], seq 8228:8384, ack 1, win 40880, length 156
16:28:37.988670 IP 99.245.77.102.54274 > 138.197.159.178.22: Flags [.], ack 6872, win 64240, length 0
16:28:37.988726 IP 138.197.159.178.22 > 99.245.77.102.54274: Flags [P.], seq 8384:8540, ack 1, win 40880, length 156
16:28:37.988920 IP 138.197.159.178.22 > 99.245.77.102.54274: Flags [P.], seq 8540:8800, ack 1, win 40880, length 260
16:28:38.011294 IP 99.245.77.102.54274 > 138.197.159.178.22: Flags [.], ack 8800, win 64240, length 0
16:28:38.011391 IP 138.197.159.178.22 > 99.245.77.102.54274: Flags [P.], seq 8800:8956, ack 1, win 40880, length 156
16:28:38.011638 IP 138.197.159.178.22 > 99.245.77.102.54274: Flags [P.], seq 8956:9216, ack 1, win 40880, length 260
16:28:38.011744 IP 138.197.159.178.22 > 99.245.77.102.54274: Flags [P.], seq 9216:9372, ack 1, win 40880, length 156
16:28:38.011868 IP 138.197.159.178.22 > 99.245.77.102.54274: Flags [P.], seq 9372:9528, ack 1, win 40880, length 156
16:28:38.011997 IP 138.197.159.178.22 > 99.245.77.102.54274: Flags [P.], seq 9528:9684, ack 1, win 40880, length 156
16:28:38.012095 IP 138.197.159.178.22 > 99.245.77.102.54274: Flags [P.], seq 9684:9840, ack 1, win 40880, length 156
16:28:38.012192 IP 138.197.159.178.22 > 99.245.77.102.54274: Flags [P.], seq 9840:9996, ack 1, win 40880, length 156
16:28:38.012291 IP 138.197.159.178.22 > 99.245.77.102.54274: Flags [P.], seq 9996:10152, ack 1, win 40880, length 156
16:28:38.012388 IP 138.197.159.178.22 > 99.245.77.102.54274: Flags [P.], seq 10152:10308, ack 1, win 40880, length 156
16:28:38.012482 IP 138.197.159.178.22 > 99.245.77.102.54274: Flags [P.], seq 10308:10464, ack 1, win 40880, length 156
16:28:38.048109 IP 99.245.77.102.54274 > 138.197.159.178.22: Flags [.], ack 8956, win 64084, length 0
16:28:38.048194 IP 138.197.159.178.22 > 99.245.77.102.54274: Flags [P.], seq 10464:10620, ack 1, win 40880, length 156
16:28:38.048221 IP 99.245.77.102.54274 > 138.197.159.178.22: Flags [.], ack 10464, win 64240, length 0
16:28:38.048494 IP 138.197.159.178.22 > 99.245.77.102.54274: Flags [P.], seq 10620:10984, ack 1, win 40880, length 364
16:28:38.048608 IP 138.197.159.178.22 > 99.245.77.102.54274: Flags [P.], seq 10984:11140, ack 1, win 40880, length 156
16:28:38.048727 IP 138.197.159.178.22 > 99.245.77.102.54274: Flags [P.], seq 11140:11296, ack 1, win 40880, length 156
16:28:38.048824 IP 138.197.159.178.22 > 99.245.77.102.54274: Flags [P.], seq 11296:11452, ack 1, win 40880, length 156
16:28:38.048920 IP 138.197.159.178.22 > 99.245.77.102.54274: Flags [P.], seq 11452:11608, ack 1, win 40880, length 156
16:28:38.049015 IP 138.197.159.178.22 > 99.245.77.102.54274: Flags [P.], seq 11608:11764, ack 1, win 40880, length 156
16:28:38.049104 IP 138.197.159.178.22 > 99.245.77.102.54274: Flags [P.], seq 11764:11920, ack 1, win 40880, length 156
16:28:38.049212 IP 138.197.159.178.22 > 99.245.77.102.54274: Flags [P.], seq 11920:12076, ack 1, win 40880, length 156
16:28:38.049370 IP 138.197.159.178.22 > 99.245.77.102.54274: Flags [P.], seq 12076:12232, ack 1, win 40880, length 156
16:28:38.062126 IP 99.245.77.102.54274 > 138.197.159.178.22: Flags [.], ack 10620, win 64084, length 0
16:28:38.062200 IP 138.197.159.178.22 > 99.245.77.102.54274: Flags [P.], seq 12232:12388, ack 1, win 40880, length 156
16:28:38.062226 IP 99.245.77.102.54274 > 138.197.159.178.22: Flags [.], ack 12232, win 64240, length 0
16:28:38.062485 IP 138.197.159.178.22 > 99.245.77.102.54274: Flags [P.], seq 12388:12752, ack 1, win 40880, length 364
16:28:38.062591 IP 138.197.159.178.22 > 99.245.77.102.54274: Flags [P.], seq 12752:12908, ack 1, win 40880, length 156
16:28:38.062687 IP 138.197.159.178.22 > 99.245.77.102.54274: Flags [P.], seq 12908:13064, ack 1, win 40880, length 156
16:28:38.062781 IP 138.197.159.178.22 > 99.245.77.102.54274: Flags [P.], seq 13064:13220, ack 1, win 40880, length 156
16:28:38.062876 IP 138.197.159.178.22 > 99.245.77.102.54274: Flags [P.], seq 13220:13376, ack 1, win 40880, length 156
16:28:38.062969 IP 138.197.159.178.22 > 99.245.77.102.54274: Flags [P.], seq 13376:13532, ack 1, win 40880, length 156
16:28:38.063063 IP 138.197.159.178.22 > 99.245.77.102.54274: Flags [P.], seq 13532:13688, ack 1, win 40880, length 156
16:28:38.063152 IP 138.197.159.178.22 > 99.245.77.102.54274: Flags [P.], seq 13688:13844, ack 1, win 40880, length 156
16:28:38.063241 IP 138.197.159.178.22 > 99.245.77.102.54274: Flags [P.], seq 13844:14000, ack 1, win 40880, length 156
16:28:38.063330 IP 138.197.159.178.22 > 99.245.77.102.54274: Flags [P.], seq 14000:14156, ack 1, win 40880, length 156
16:28:38.089762 IP 99.245.77.102.54274 > 138.197.159.178.22: Flags [.], ack 14156, win 64240, length 0
16:28:38.089855 IP 138.197.159.178.22 > 99.245.77.102.54274: Flags [P.], seq 14156:14312, ack 1, win 40880, length 156
16:28:38.090114 IP 138.197.159.178.22 > 99.245.77.102.54274: Flags [P.], seq 14312:14572, ack 1, win 40880, length 260
16:28:38.090218 IP 138.197.159.178.22 > 99.245.77.102.54274: Flags [P.], seq 14572:14728, ack 1, win 40880, length 156
16:28:38.090311 IP 138.197.159.178.22 > 99.245.77.102.54274: Flags [P.], seq 14728:14884, ack 1, win 40880, length 156
16:28:38.090405 IP 138.197.159.178.22 > 99.245.77.102.54274: Flags [P.], seq 14884:15040, ack 1, win 40880, length 156
16:28:38.090500 IP 138.197.159.178.22 > 99.245.77.102.54274: Flags [P.], seq 15040:15196, ack 1, win 40880, length 156
16:28:38.090592 IP 138.197.159.178.22 > 99.245.77.102.54274: Flags [P.], seq 15196:15352, ack 1, win 40880, length 156
16:28:38.090678 IP 138.197.159.178.22 > 99.245.77.102.54274: Flags [P.], seq 15352:15508, ack 1, win 40880, length 156
16:28:38.090757 IP 138.197.159.178.22 > 99.245.77.102.54274: Flags [P.], seq 15508:15664, ack 1, win 40880, length 156
16:28:38.090844 IP 138.197.159.178.22 > 99.245.77.102.54274: Flags [P.], seq 15664:15820, ack 1, win 40880, length 156
16:28:38.090932 IP 138.197.159.178.22 > 99.245.77.102.54274: Flags [P.], seq 15820:15976, ack 1, win 40880, length 156
16:28:38.109983 IP 99.245.77.102.54274 > 138.197.159.178.22: Flags [.], ack 15040, win 63356, length 0
16:28:38.110063 IP 138.197.159.178.22 > 99.245.77.102.54274: Flags [P.], seq 15976:16132, ack 1, win 40880, length 156
16:28:38.110337 IP 138.197.159.178.22 > 99.245.77.102.54274: Flags [P.], seq 16132:16392, ack 1, win 40880, length 260
16:28:38.110459 IP 138.197.159.178.22 > 99.245.77.102.54274: Flags [P.], seq 16392:16548, ack 1, win 40880, length 156
16:28:38.110553 IP 138.197.159.178.22 > 99.245.77.102.54274: Flags [P.], seq 16548:16704, ack 1, win 40880, length 156
16:28:38.110644 IP 138.197.159.178.22 > 99.245.77.102.54274: Flags [P.], seq 16704:16860, ack 1, win 40880, length 156
16:28:38.114995 IP 99.245.77.102.54274 > 138.197.159.178.22: Flags [.], ack 15196, win 63200, length 0
16:28:38.115031 IP 138.197.159.178.22 > 99.245.77.102.54274: Flags [P.], seq 16860:17016, ack 1, win 40880, length 156
16:28:38.115049 IP 99.245.77.102.54274 > 138.197.159.178.22: Flags [.], ack 15976, win 64240, length 0
16:28:38.115218 IP 138.197.159.178.22 > 99.245.77.102.54274: Flags [P.], seq 17016:17380, ack 1, win 40880, length 364
16:28:38.115316 IP 138.197.159.178.22 > 99.245.77.102.54274: Flags [P.], seq 17380:17536, ack 1, win 40880, length 156
16:28:38.115433 IP 138.197.159.178.22 > 99.245.77.102.54274: Flags [P.], seq 17536:17692, ack 1, win 40880, length 156
16:28:38.115527 IP 138.197.159.178.22 > 99.245.77.102.54274: Flags [P.], seq 17692:17848, ack 1, win 40880, length 156
16:28:38.115625 IP 138.197.159.178.22 > 99.245.77.102.54274: Flags [P.], seq 17848:18004, ack 1, win 40880, length 156
16:28:38.115715 IP 138.197.159.178.22 > 99.245.77.102.54274: Flags [P.], seq 18004:18160, ack 1, win 40880, length 156
16:28:38.121795 IP 99.245.77.102.54274 > 138.197.159.178.22: Flags [.], ack 16132, win 64084, length 0
16:28:38.121842 IP 138.197.159.178.22 > 99.245.77.102.54274: Flags [P.], seq 18160:18316, ack 1, win 40880, length 156
16:28:38.121862 IP 99.245.77.102.54274 > 138.197.159.178.22: Flags [.], ack 16860, win 63356, length 0
16:28:38.122054 IP 138.197.159.178.22 > 99.245.77.102.54274: Flags [P.], seq 18316:18680, ack 1, win 40880, length 364
16:28:38.122155 IP 138.197.159.178.22 > 99.245.77.102.54274: Flags [P.], seq 18680:18836, ack 1, win 40880, length 156
16:28:38.122285 IP 138.197.159.178.22 > 99.245.77.102.54274: Flags [P.], seq 18836:18992, ack 1, win 40880, length 156
16:28:38.122382 IP 138.197.159.178.22 > 99.245.77.102.54274: Flags [P.], seq 18992:19148, ack 1, win 40880, length 156
16:28:38.126567 IP 99.245.77.102.54274 > 138.197.159.178.22: Flags [.], ack 18160, win 64240, length 0
16:28:38.126611 IP 138.197.159.178.22 > 99.245.77.102.54274: Flags [P.], seq 19148:19304, ack 1, win 40880, length 156
16:28:38.126795 IP 138.197.159.178.22 > 99.245.77.102.54274: Flags [P.], seq 19304:19564, ack 1, win 40880, length 260
16:28:38.126903 IP 138.197.159.178.22 > 99.245.77.102.54274: Flags [P.], seq 19564:19720, ack 1, win 40880, length 156
16:28:38.126999 IP 138.197.159.178.22 > 99.245.77.102.54274: Flags [P.], seq 19720:19876, ack 1, win 40880, length 156
16:28:38.127092 IP 138.197.159.178.22 > 99.245.77.102.54274: Flags [P.], seq 19876:20032, ack 1, win 40880, length 156
16:28:38.127184 IP 138.197.159.178.22 > 99.245.77.102.54274: Flags [P.], seq 20032:20188, ack 1, win 40880, length 156
16:28:38.127277 IP 138.197.159.178.22 > 99.245.77.102.54274: Flags [P.], seq 20188:20344, ack 1, win 40880, length 156
16:28:38.134984 IP 99.245.77.102.54274 > 138.197.159.178.22: Flags [.], ack 18316, win 64084, length 0
16:28:38.135036 IP 138.197.159.178.22 > 99.245.77.102.54274: Flags [P.], seq 20344:20500, ack 1, win 40880, length 156
16:28:38.140926 IP 99.245.77.102.54274 > 138.197.159.178.22: Flags [.], ack 18836, win 63564, length 0
16:28:38.140995 IP 138.197.159.178.22 > 99.245.77.102.54274: Flags [P.], seq 20500:20760, ack 1, win 40880, length 260
16:28:38.141028 IP 99.245.77.102.54274 > 138.197.159.178.22: Flags [.], ack 19148, win 63252, length 0
16:28:38.141039 IP 99.245.77.102.54274 > 138.197.159.178.22: Flags [.], ack 20188, win 64240, length 0
16:28:38.141332 IP 138.197.159.178.22 > 99.245.77.102.54274: Flags [P.], seq 20760:21228, ack 1, win 40880, length 468
16:28:38.141467 IP 138.197.159.178.22 > 99.245.77.102.54274: Flags [P.], seq 21228:21384, ack 1, win 40880, length 156
16:28:38.141625 IP 138.197.159.178.22 > 99.245.77.102.54274: Flags [P.], seq 21384:21540, ack 1, win 40880, length 156
16:28:38.141770 IP 138.197.159.178.22 > 99.245.77.102.54274: Flags [P.], seq 21540:21696, ack 1, win 40880, length 156
16:28:38.141903 IP 138.197.159.178.22 > 99.245.77.102.54274: Flags [P.], seq 21696:21852, ack 1, win 40880, length 156
16:28:38.142067 IP 138.197.159.178.22 > 99.245.77.102.54274: Flags [P.], seq 21852:22008, ack 1, win 40880, length 156
16:28:38.142175 IP 138.197.159.178.22 > 99.245.77.102.54274: Flags [P.], seq 22008:22164, ack 1, win 40880, length 156
16:28:38.142302 IP 138.197.159.178.22 > 99.245.77.102.54274: Flags [P.], seq 22164:22320, ack 1, win 40880, length 156
16:28:38.142447 IP 138.197.159.178.22 > 99.245.77.102.54274: Flags [P.], seq 22320:22476, ack 1, win 40880, length 156
16:28:38.142586 IP 138.197.159.178.22 > 99.245.77.102.54274: Flags [P.], seq 22476:22632, ack 1, win 40880, length 156
16:28:38.148303 IP 99.245.77.102.54274 > 138.197.159.178.22: Flags [.], ack 20500, win 63928, length 0
16:28:38.148361 IP 138.197.159.178.22 > 99.245.77.102.54274: Flags [P.], seq 22632:22788, ack 1, win 40880, length 156
16:28:38.148594 IP 138.197.159.178.22 > 99.245.77.102.54274: Flags [P.], seq 22788:23048, ack 1, win 40880, length 260
16:28:38.153146 IP 99.245.77.102.54274 > 138.197.159.178.22: Flags [.], ack 21696, win 64240, length 0
16:28:38.153214 IP 138.197.159.178.22 > 99.245.77.102.54274: Flags [P.], seq 23048:23204, ack 1, win 40880, length 156
16:28:38.153238 IP 99.245.77.102.54274 > 138.197.159.178.22: Flags [.], ack 21852, win 64084, length 0
16:28:38.153476 IP 138.197.159.178.22 > 99.245.77.102.54274: Flags [P.], seq 23204:23568, ack 1, win 40880, length 364
16:28:38.153621 IP 138.197.159.178.22 > 99.245.77.102.54274: Flags [P.], seq 23568:23724, ack 1, win 40880, length 156
16:28:38.153755 IP 138.197.159.178.22 > 99.245.77.102.54274: Flags [P.], seq 23724:23880, ack 1, win 40880, length 156
16:28:38.153896 IP 138.197.159.178.22 > 99.245.77.102.54274: Flags [P.], seq 23880:24036, ack 1, win 40880, length 156
16:28:38.154084 IP 138.197.159.178.22 > 99.245.77.102.54274: Flags [P.], seq 24036:24192, ack 1, win 40880, length 156
16:28:38.157709 IP 99.245.77.102.54274 > 138.197.159.178.22: Flags [.], ack 22632, win 63304, length 0
16:28:38.157772 IP 138.197.159.178.22 > 99.245.77.102.54274: Flags [P.], seq 24192:24348, ack 1, win 40880, length 156
16:28:38.158455 IP 138.197.159.178.22 > 99.245.77.102.54274: Flags [P.], seq 24348:24608, ack 1, win 40880, length 260
16:28:38.158651 IP 138.197.159.178.22 > 99.245.77.102.54274: Flags [P.], seq 24608:24764, ack 1, win 40880, length 156
16:28:38.158769 IP 138.197.159.178.22 > 99.245.77.102.54274: Flags [P.], seq 24764:24920, ack 1, win 40880, length 156
16:28:38.158874 IP 138.197.159.178.22 > 99.245.77.102.54274: Flags [P.], seq 24920:25076, ack 1, win 40880, length 156
16:28:38.163550 IP 99.245.77.102.54274 > 138.197.159.178.22: Flags [.], ack 22788, win 63148, length 0
16:28:38.163585 IP 138.197.159.178.22 > 99.245.77.102.54274: Flags [P.], seq 25076:25232, ack 1, win 40880, length 156
16:28:38.163746 IP 138.197.159.178.22 > 99.245.77.102.54274: Flags [P.], seq 25232:25492, ack 1, win 40880, length 260
16:28:38.168626 IP 99.245.77.102.54274 > 138.197.159.178.22: Flags [.], ack 23204, win 64240, length 0
16:28:38.168667 IP 138.197.159.178.22 > 99.245.77.102.54274: Flags [P.], seq 25492:25648, ack 1, win 40880, length 156
16:28:38.168690 IP 99.245.77.102.54274 > 138.197.159.178.22: Flags [.], ack 23724, win 63720, length 0
16:28:38.168699 IP 99.245.77.102.54274 > 138.197.159.178.22: Flags [.], ack 24036, win 63408, length 0
16:28:38.168893 IP 138.197.159.178.22 > 99.245.77.102.54274: Flags [P.], seq 25648:26116, ack 1, win 40880, length 468
16:28:38.168999 IP 138.197.159.178.22 > 99.245.77.102.54274: Flags [P.], seq 26116:26272, ack 1, win 40880, length 156
16:28:38.169093 IP 138.197.159.178.22 > 99.245.77.102.54274: Flags [P.], seq 26272:26428, ack 1, win 40880, length 156
16:28:38.169196 IP 138.197.159.178.22 > 99.245.77.102.54274: Flags [P.], seq 26428:26584, ack 1, win 40880, length 156
16:28:38.169287 IP 138.197.159.178.22 > 99.245.77.102.54274: Flags [P.], seq 26584:26740, ack 1, win 40880, length 156
16:28:38.172580 IP 99.245.77.102.54274 > 138.197.159.178.22: Flags [.], ack 24348, win 63096, length 0
16:28:38.172640 IP 138.197.159.178.22 > 99.245.77.102.54274: Flags [P.], seq 26740:26896, ack 1, win 40880, length 156
16:28:38.172678 IP 99.245.77.102.54274 > 138.197.159.178.22: Flags [.], ack 25076, win 64240, length 0
16:28:38.172952 IP 138.197.159.178.22 > 99.245.77.102.54274: Flags [P.], seq 26896:27260, ack 1, win 40880, length 364
16:28:38.173095 IP 138.197.159.178.22 > 99.245.77.102.54274: Flags [P.], seq 27260:27416, ack 1, win 40880, length 156
16:28:38.173212 IP 138.197.159.178.22 > 99.245.77.102.54274: Flags [P.], seq 27416:27572, ack 1, win 40880, length 156
16:28:38.173370 IP 138.197.159.178.22 > 99.245.77.102.54274: Flags [P.], seq 27572:27728, ack 1, win 40880, length 156
16:28:38.173509 IP 138.197.159.178.22 > 99.245.77.102.54274: Flags [P.], seq 27728:27884, ack 1, win 40880, length 156
16:28:38.178280 IP 99.245.77.102.54274 > 138.197.159.178.22: Flags [.], ack 25492, win 63824, length 0
16:28:38.178327 IP 138.197.159.178.22 > 99.245.77.102.54274: Flags [P.], seq 27884:28040, ack 1, win 40880, length 156
16:28:38.178517 IP 138.197.159.178.22 > 99.245.77.102.54274: Flags [P.], seq 28040:28300, ack 1, win 40880, length 260
16:28:38.189564 IP 99.245.77.102.54274 > 138.197.159.178.22: Flags [.], ack 27884, win 64240, length 0
16:28:38.189657 IP 138.197.159.178.22 > 99.245.77.102.54274: Flags [P.], seq 28300:28456, ack 1, win 40880, length 156
16:28:38.189999 IP 138.197.159.178.22 > 99.245.77.102.54274: Flags [P.], seq 28456:28716, ack 1, win 40880, length 260
16:28:38.190166 IP 138.197.159.178.22 > 99.245.77.102.54274: Flags [P.], seq 28716:28872, ack 1, win 40880, length 156
16:28:38.190316 IP 138.197.159.178.22 > 99.245.77.102.54274: Flags [P.], seq 28872:29028, ack 1, win 40880, length 156
16:28:38.190477 IP 138.197.159.178.22 > 99.245.77.102.54274: Flags [P.], seq 29028:29184, ack 1, win 40880, length 156
16:28:38.190595 IP 138.197.159.178.22 > 99.245.77.102.54274: Flags [P.], seq 29184:29340, ack 1, win 40880, length 156
16:28:38.190756 IP 138.197.159.178.22 > 99.245.77.102.54274: Flags [P.], seq 29340:29496, ack 1, win 40880, length 156
16:28:38.190903 IP 138.197.159.178.22 > 99.245.77.102.54274: Flags [P.], seq 29496:29652, ack 1, win 40880, length 156
16:28:38.191083 IP 138.197.159.178.22 > 99.245.77.102.54274: Flags [P.], seq 29652:29808, ack 1, win 40880, length 156
16:28:38.191253 IP 138.197.159.178.22 > 99.245.77.102.54274: Flags [P.], seq 29808:29964, ack 1, win 40880, length 156
16:28:38.191496 IP 138.197.159.178.22 > 99.245.77.102.54274: Flags [P.], seq 29964:30120, ack 1, win 40880, length 156
16:28:38.191696 IP 138.197.159.178.22 > 99.245.77.102.54274: Flags [P.], seq 30120:30276, ack 1, win 40880, length 156
16:28:38.191855 IP 138.197.159.178.22 > 99.245.77.102.54274: Flags [P.], seq 30276:30432, ack 1, win 40880, length 156
16:28:38.194574 IP 99.245.77.102.54274 > 138.197.159.178.22: Flags [.], ack 28300, win 63824, length 0
16:28:38.194618 IP 138.197.159.178.22 > 99.245.77.102.54274: Flags [P.], seq 30432:30588, ack 1, win 40880, length 156
16:28:38.194809 IP 138.197.159.178.22 > 99.245.77.102.54274: Flags [P.], seq 30588:30848, ack 1, win 40880, length 260
16:28:38.199021 IP 99.245.77.102.54274 > 138.197.159.178.22: Flags [.], ack 29652, win 64240, length 0
16:28:38.199082 IP 138.197.159.178.22 > 99.245.77.102.54274: Flags [P.], seq 30848:31004, ack 1, win 40880, length 156
16:28:38.199249 IP 138.197.159.178.22 > 99.245.77.102.54274: Flags [P.], seq 31004:31264, ack 1, win 40880, length 260
16:28:38.199367 IP 138.197.159.178.22 > 99.245.77.102.54274: Flags [P.], seq 31264:31420, ack 1, win 40880, length 156
16:28:38.199515 IP 138.197.159.178.22 > 99.245.77.102.54274: Flags [P.], seq 31420:31576, ack 1, win 40880, length 156
16:28:38.199624 IP 138.197.159.178.22 > 99.245.77.102.54274: Flags [P.], seq 31576:31732, ack 1, win 40880, length 156
16:28:38.199759 IP 138.197.159.178.22 > 99.245.77.102.54274: Flags [P.], seq 31732:31888, ack 1, win 40880, length 156
16:28:38.199916 IP 138.197.159.178.22 > 99.245.77.102.54274: Flags [P.], seq 31888:32044, ack 1, win 40880, length 156
16:28:38.200178 IP 138.197.159.178.22 > 99.245.77.102.54274: Flags [P.], seq 32044:32200, ack 1, win 40880, length 156
16:28:38.221919 IP 99.245.77.102.54274 > 138.197.159.178.22: Flags [.], ack 30432, win 63460, length 0
16:28:38.222022 IP 138.197.159.178.22 > 99.245.77.102.54274: Flags [P.], seq 32200:32356, ack 1, win 40880, length 156
16:28:38.222064 IP 99.245.77.102.54274 > 138.197.159.178.22: Flags [.], ack 32200, win 64240, length 0
16:28:38.222431 IP 138.197.159.178.22 > 99.245.77.102.54274: Flags [P.], seq 32356:32720, ack 1, win 40880, length 364
16:28:38.222563 IP 138.197.159.178.22 > 99.245.77.102.54274: Flags [P.], seq 32720:32876, ack 1, win 40880, length 156
16:28:38.222691 IP 138.197.159.178.22 > 99.245.77.102.54274: Flags [P.], seq 32876:33032, ack 1, win 40880, length 156
16:28:38.222828 IP 138.197.159.178.22 > 99.245.77.102.54274: Flags [P.], seq 33032:33188, ack 1, win 40880, length 156
16:28:38.222990 IP 138.197.159.178.22 > 99.245.77.102.54274: Flags [P.], seq 33188:33344, ack 1, win 40880, length 156
16:28:38.223125 IP 138.197.159.178.22 > 99.245.77.102.54274: Flags [P.], seq 33344:33500, ack 1, win 40880, length 156
16:28:38.223284 IP 138.197.159.178.22 > 99.245.77.102.54274: Flags [P.], seq 33500:33656, ack 1, win 40880, length 156
16:28:38.223463 IP 138.197.159.178.22 > 99.245.77.102.54274: Flags [P.], seq 33656:33812, ack 1, win 40880, length 156
16:28:38.223587 IP 138.197.159.178.22 > 99.245.77.102.54274: Flags [P.], seq 33812:33968, ack 1, win 40880, length 156
16:28:38.223725 IP 138.197.159.178.22 > 99.245.77.102.54274: Flags [P.], seq 33968:34124, ack 1, win 40880, length 156
16:28:38.223856 IP 138.197.159.178.22 > 99.245.77.102.54274: Flags [P.], seq 34124:34280, ack 1, win 40880, length 156
16:28:38.224018 IP 138.197.159.178.22 > 99.245.77.102.54274: Flags [P.], seq 34280:34436, ack 1, win 40880, length 156
16:28:38.224169 IP 138.197.159.178.22 > 99.245.77.102.54274: Flags [P.], seq 34436:34592, ack 1, win 40880, length 156
16:28:38.224304 IP 138.197.159.178.22 > 99.245.77.102.54274: Flags [P.], seq 34592:34748, ack 1, win 40880, length 156
16:28:38.224443 IP 138.197.159.178.22 > 99.245.77.102.54274: Flags [P.], seq 34748:34904, ack 1, win 40880, length 156
16:28:38.233848 IP 99.245.77.102.54274 > 138.197.159.178.22: Flags [.], ack 32356, win 64084, length 0
16:28:38.233909 IP 138.197.159.178.22 > 99.245.77.102.54274: Flags [P.], seq 34904:35060, ack 1, win 40880, length 156
16:28:38.233935 IP 99.245.77.102.54274 > 138.197.159.178.22: Flags [.], ack 33032, win 63408, length 0
16:28:38.234182 IP 138.197.159.178.22 > 99.245.77.102.54274: Flags [P.], seq 35060:35424, ack 1, win 40880, length 364
16:28:38.234298 IP 138.197.159.178.22 > 99.245.77.102.54274: Flags [P.], seq 35424:35580, ack 1, win 40880, length 156
16:28:38.234403 IP 138.197.159.178.22 > 99.245.77.102.54274: Flags [P.], seq 35580:35736, ack 1, win 40880, length 156
16:28:38.239772 IP 99.245.77.102.54274 > 138.197.159.178.22: Flags [.], ack 33344, win 63096, length 0
16:28:38.239811 IP 138.197.159.178.22 > 99.245.77.102.54274: Flags [P.], seq 35736:35892, ack 1, win 40880, length 156
16:28:38.239834 IP 99.245.77.102.54274 > 138.197.159.178.22: Flags [.], ack 34904, win 64240, length 0
16:28:38.240067 IP 138.197.159.178.22 > 99.245.77.102.54274: Flags [P.], seq 35892:36256, ack 1, win 40880, length 364
16:28:38.240181 IP 138.197.159.178.22 > 99.245.77.102.54274: Flags [P.], seq 36256:36412, ack 1, win 40880, length 156
16:28:38.240287 IP 138.197.159.178.22 > 99.245.77.102.54274: Flags [P.], seq 36412:36568, ack 1, win 40880, length 156
16:28:38.240389 IP 138.197.159.178.22 > 99.245.77.102.54274: Flags [P.], seq 36568:36724, ack 1, win 40880, length 156
16:28:38.240493 IP 138.197.159.178.22 > 99.245.77.102.54274: Flags [P.], seq 36724:36880, ack 1, win 40880, length 156
16:28:38.240599 IP 138.197.159.178.22 > 99.245.77.102.54274: Flags [P.], seq 36880:37036, ack 1, win 40880, length 156
16:28:38.240704 IP 138.197.159.178.22 > 99.245.77.102.54274: Flags [P.], seq 37036:37192, ack 1, win 40880, length 156
16:28:38.240827 IP 138.197.159.178.22 > 99.245.77.102.54274: Flags [P.], seq 37192:37348, ack 1, win 40880, length 156
16:28:38.240937 IP 138.197.159.178.22 > 99.245.77.102.54274: Flags [P.], seq 37348:37504, ack 1, win 40880, length 156
16:28:38.241039 IP 138.197.159.178.22 > 99.245.77.102.54274: Flags [P.], seq 37504:37660, ack 1, win 40880, length 156
16:28:38.241142 IP 138.197.159.178.22 > 99.245.77.102.54274: Flags [P.], seq 37660:37816, ack 1, win 40880, length 156
16:28:38.246209 IP 99.245.77.102.54274 > 138.197.159.178.22: Flags [.], ack 35060, win 64084, length 0
16:28:38.246264 IP 138.197.159.178.22 > 99.245.77.102.54274: Flags [P.], seq 37816:37972, ack 1, win 40880, length 156
16:28:38.246285 IP 99.245.77.102.54274 > 138.197.159.178.22: Flags [.], ack 35736, win 63408, length 0
16:28:38.246475 IP 138.197.159.178.22 > 99.245.77.102.54274: Flags [P.], seq 37972:38336, ack 1, win 40880, length 364
16:28:38.246589 IP 138.197.159.178.22 > 99.245.77.102.54274: Flags [P.], seq 38336:38492, ack 1, win 40880, length 156
16:28:38.246693 IP 138.197.159.178.22 > 99.245.77.102.54274: Flags [P.], seq 38492:38648, ack 1, win 40880, length 156
16:28:38.246795 IP 138.197.159.178.22 > 99.245.77.102.54274: Flags [P.], seq 38648:38804, ack 1, win 40880, length 156
16:28:38.256422 IP 99.245.77.102.54274 > 138.197.159.178.22: Flags [.], ack 37660, win 64240, length 0
16:28:38.256491 IP 138.197.159.178.22 > 99.245.77.102.54274: Flags [P.], seq 38804:38960, ack 1, win 40880, length 156
16:28:38.256629 IP 99.245.77.102.54274 > 138.197.159.178.22: Flags [.], ack 37972, win 63928, length 0
16:28:38.256819 IP 138.197.159.178.22 > 99.245.77.102.54274: Flags [P.], seq 38960:39324, ack 1, win 40880, length 364
16:28:38.256937 IP 138.197.159.178.22 > 99.245.77.102.54274: Flags [P.], seq 39324:39480, ack 1, win 40880, length 156
16:28:38.257046 IP 138.197.159.178.22 > 99.245.77.102.54274: Flags [P.], seq 39480:39636, ack 1, win 40880, length 156
16:28:38.257150 IP 138.197.159.178.22 > 99.245.77.102.54274: Flags [P.], seq 39636:39792, ack 1, win 40880, length 156
16:28:38.257251 IP 138.197.159.178.22 > 99.245.77.102.54274: Flags [P.], seq 39792:39948, ack 1, win 40880, length 156
16:28:38.257355 IP 138.197.159.178.22 > 99.245.77.102.54274: Flags [P.], seq 39948:40104, ack 1, win 40880, length 156
16:28:38.257458 IP 138.197.159.178.22 > 99.245.77.102.54274: Flags [P.], seq 40104:40260, ack 1, win 40880, length 156
16:28:38.257561 IP 138.197.159.178.22 > 99.245.77.102.54274: Flags [P.], seq 40260:40416, ack 1, win 40880, length 156
16:28:38.257664 IP 138.197.159.178.22 > 99.245.77.102.54274: Flags [P.], seq 40416:40572, ack 1, win 40880, length 156
16:28:38.257766 IP 138.197.159.178.22 > 99.245.77.102.54274: Flags [P.], seq 40572:40728, ack 1, win 40880, length 156
16:28:38.257868 IP 138.197.159.178.22 > 99.245.77.102.54274: Flags [P.], seq 40728:40884, ack 1, win 40880, length 156
16:28:38.257970 IP 138.197.159.178.22 > 99.245.77.102.54274: Flags [P.], seq 40884:41040, ack 1, win 40880, length 156
16:28:38.261994 IP 99.245.77.102.54274 > 138.197.159.178.22: Flags [.], ack 38804, win 63096, length 0
16:28:38.262050 IP 138.197.159.178.22 > 99.245.77.102.54274: Flags [P.], seq 41040:41196, ack 1, win 40880, length 156
16:28:38.262261 IP 138.197.159.178.22 > 99.245.77.102.54274: Flags [P.], seq 41196:41456, ack 1, win 40880, length 260
16:28:38.262376 IP 138.197.159.178.22 > 99.245.77.102.54274: Flags [P.], seq 41456:41612, ack 1, win 40880, length 156
16:28:38.262481 IP 138.197.159.178.22 > 99.245.77.102.54274: Flags [P.], seq 41612:41768, ack 1, win 40880, length 156
16:28:38.267639 IP 99.245.77.102.54274 > 138.197.159.178.22: Flags [.], ack 39324, win 64240, length 0
16:28:38.267705 IP 138.197.159.178.22 > 99.245.77.102.54274: Flags [P.], seq 41768:41924, ack 1, win 40880, length 156
16:28:38.267743 IP 99.245.77.102.54274 > 138.197.159.178.22: Flags [.], ack 39636, win 63928, length 0
16:28:38.268034 IP 138.197.159.178.22 > 99.245.77.102.54274: Flags [P.], seq 41924:42288, ack 1, win 40880, length 364
16:28:38.268168 IP 138.197.159.178.22 > 99.245.77.102.54274: Flags [P.], seq 42288:42444, ack 1, win 40880, length 156
16:28:38.268281 IP 138.197.159.178.22 > 99.245.77.102.54274: Flags [P.], seq 42444:42600, ack 1, win 40880, length 156
16:28:38.268388 IP 138.197.159.178.22 > 99.245.77.102.54274: Flags [P.], seq 42600:42756, ack 1, win 40880, length 156
16:28:38.273425 IP 99.245.77.102.54274 > 138.197.159.178.22: Flags [.], ack 40260, win 63304, length 0
16:28:38.273460 IP 138.197.159.178.22 > 99.245.77.102.54274: Flags [P.], seq 42756:42912, ack 1, win 40880, length 156
16:28:38.273632 IP 138.197.159.178.22 > 99.245.77.102.54274: Flags [P.], seq 42912:43172, ack 1, win 40880, length 260
16:28:38.273721 IP 138.197.159.178.22 > 99.245.77.102.54274: Flags [P.], seq 43172:43328, ack 1, win 40880, length 156
16:28:38.273806 IP 138.197.159.178.22 > 99.245.77.102.54274: Flags [P.], seq 43328:43484, ack 1, win 40880, length 156
16:28:38.283620 IP 99.245.77.102.54274 > 138.197.159.178.22: Flags [.], ack 41040, win 64240, length 0
16:28:38.283668 IP 138.197.159.178.22 > 99.245.77.102.54274: Flags [P.], seq 43484:43640, ack 1, win 40880, length 156
16:28:38.283894 IP 138.197.159.178.22 > 99.245.77.102.54274: Flags [P.], seq 43640:43900, ack 1, win 40880, length 260
16:28:38.284028 IP 138.197.159.178.22 > 99.245.77.102.54274: Flags [P.], seq 43900:44056, ack 1, win 40880, length 156
16:28:38.284112 IP 138.197.159.178.22 > 99.245.77.102.54274: Flags [P.], seq 44056:44212, ack 1, win 40880, length 156
16:28:38.284188 IP 138.197.159.178.22 > 99.245.77.102.54274: Flags [P.], seq 44212:44368, ack 1, win 40880, length 156
16:28:38.290415 IP 99.245.77.102.54274 > 138.197.159.178.22: Flags [.], ack 41768, win 63512, length 0
16:28:38.290463 IP 138.197.159.178.22 > 99.245.77.102.54274: Flags [P.], seq 44368:44524, ack 1, win 40880, length 156
16:28:38.290487 IP 99.245.77.102.54274 > 138.197.159.178.22: Flags [.], ack 43484, win 64240, length 0
16:28:38.290644 IP 138.197.159.178.22 > 99.245.77.102.54274: Flags [P.], seq 44524:44888, ack 1, win 40880, length 364
16:28:38.290733 IP 138.197.159.178.22 > 99.245.77.102.54274: Flags [P.], seq 44888:45044, ack 1, win 40880, length 156
16:28:38.290807 IP 138.197.159.178.22 > 99.245.77.102.54274: Flags [P.], seq 45044:45200, ack 1, win 40880, length 156
16:28:38.290880 IP 138.197.159.178.22 > 99.245.77.102.54274: Flags [P.], seq 45200:45356, ack 1, win 40880, length 156
16:28:38.290951 IP 138.197.159.178.22 > 99.245.77.102.54274: Flags [P.], seq 45356:45512, ack 1, win 40880, length 156
16:28:38.291021 IP 138.197.159.178.22 > 99.245.77.102.54274: Flags [P.], seq 45512:45668, ack 1, win 40880, length 156
16:28:38.291093 IP 138.197.159.178.22 > 99.245.77.102.54274: Flags [P.], seq 45668:45824, ack 1, win 40880, length 156
16:28:38.291164 IP 138.197.159.178.22 > 99.245.77.102.54274: Flags [P.], seq 45824:45980, ack 1, win 40880, length 156
16:28:38.291247 IP 138.197.159.178.22 > 99.245.77.102.54274: Flags [P.], seq 45980:46136, ack 1, win 40880, length 156
16:28:38.291346 IP 138.197.159.178.22 > 99.245.77.102.54274: Flags [P.], seq 46136:46292, ack 1, win 40880, length 156
16:28:38.291443 IP 138.197.159.178.22 > 99.245.77.102.54274: Flags [P.], seq 46292:46448, ack 1, win 40880, length 156
16:28:38.291520 IP 138.197.159.178.22 > 99.245.77.102.54274: Flags [P.], seq 46448:46604, ack 1, win 40880, length 156
16:28:38.291593 IP 138.197.159.178.22 > 99.245.77.102.54274: Flags [P.], seq 46604:46760, ack 1, win 40880, length 156
16:28:38.301681 IP 99.245.77.102.54274 > 138.197.159.178.22: Flags [.], ack 44368, win 63356, length 0
16:28:38.301724 IP 138.197.159.178.22 > 99.245.77.102.54274: Flags [P.], seq 46760:46916, ack 1, win 40880, length 156
16:28:38.301892 IP 138.197.159.178.22 > 99.245.77.102.54274: Flags [P.], seq 46916:47176, ack 1, win 40880, length 260
16:28:38.301979 IP 138.197.159.178.22 > 99.245.77.102.54274: Flags [P.], seq 47176:47332, ack 1, win 40880, length 156
16:28:38.302060 IP 138.197.159.178.22 > 99.245.77.102.54274: Flags [P.], seq 47332:47488, ack 1, win 40880, length 156
16:28:38.302135 IP 138.197.159.178.22 > 99.245.77.102.54274: Flags [P.], seq 47488:47644, ack 1, win 40880, length 156
16:28:38.309434 IP 99.245.77.102.54274 > 138.197.159.178.22: Flags [.], ack 46292, win 64240, length 0
16:28:38.309496 IP 138.197.159.178.22 > 99.245.77.102.54274: Flags [P.], seq 47644:47800, ack 1, win 40880, length 156
16:28:38.309666 IP 138.197.159.178.22 > 99.245.77.102.54274: Flags [P.], seq 47800:48060, ack 1, win 40880, length 260
16:28:38.309735 IP 99.245.77.102.54274 > 138.197.159.178.22: Flags [.], ack 46760, win 63772, length 0
16:28:38.309818 IP 138.197.159.178.22 > 99.245.77.102.54274: Flags [P.], seq 48060:48320, ack 1, win 40880, length 260
16:28:38.309898 IP 138.197.159.178.22 > 99.245.77.102.54274: Flags [P.], seq 48320:48476, ack 1, win 40880, length 156
16:28:38.309972 IP 138.197.159.178.22 > 99.245.77.102.54274: Flags [P.], seq 48476:48632, ack 1, win 40880, length 156
16:28:38.310044 IP 138.197.159.178.22 > 99.245.77.102.54274: Flags [P.], seq 48632:48788, ack 1, win 40880, length 156
16:28:38.310116 IP 138.197.159.178.22 > 99.245.77.102.54274: Flags [P.], seq 48788:48944, ack 1, win 40880, length 156
16:28:38.310186 IP 138.197.159.178.22 > 99.245.77.102.54274: Flags [P.], seq 48944:49100, ack 1, win 40880, length 156
16:28:38.310270 IP 138.197.159.178.22 > 99.245.77.102.54274: Flags [P.], seq 49100:49256, ack 1, win 40880, length 156
16:28:38.310344 IP 138.197.159.178.22 > 99.245.77.102.54274: Flags [P.], seq 49256:49412, ack 1, win 40880, length 156
16:28:38.310448 IP 138.197.159.178.22 > 99.245.77.102.54274: Flags [P.], seq 49412:49568, ack 1, win 40880, length 156
16:28:38.310532 IP 138.197.159.178.22 > 99.245.77.102.54274: Flags [P.], seq 49568:49724, ack 1, win 40880, length 156
16:28:38.310604 IP 138.197.159.178.22 > 99.245.77.102.54274: Flags [P.], seq 49724:49880, ack 1, win 40880, length 156
16:28:38.310676 IP 138.197.159.178.22 > 99.245.77.102.54274: Flags [P.], seq 49880:50036, ack 1, win 40880, length 156
16:28:38.310747 IP 138.197.159.178.22 > 99.245.77.102.54274: Flags [P.], seq 50036:50192, ack 1, win 40880, length 156
16:28:38.314550 IP 99.245.77.102.54274 > 138.197.159.178.22: Flags [.], ack 46916, win 63616, length 0
16:28:38.314590 IP 138.197.159.178.22 > 99.245.77.102.54274: Flags [P.], seq 50192:50348, ack 1, win 40880, length 156
16:28:38.314616 IP 99.245.77.102.54274 > 138.197.159.178.22: Flags [.], ack 47644, win 62888, length 0
16:28:38.314782 IP 138.197.159.178.22 > 99.245.77.102.54274: Flags [P.], seq 50348:50712, ack 1, win 40880, length 364
16:28:38.314892 IP 138.197.159.178.22 > 99.245.77.102.54274: Flags [P.], seq 50712:50868, ack 1, win 40880, length 156
16:28:38.315020 IP 138.197.159.178.22 > 99.245.77.102.54274: Flags [P.], seq 50868:51024, ack 1, win 40880, length 156
16:28:38.315144 IP 138.197.159.178.22 > 99.245.77.102.54274: Flags [P.], seq 51024:51180, ack 1, win 40880, length 156
16:28:38.325801 IP 99.245.77.102.54274 > 138.197.159.178.22: Flags [.], ack 49568, win 64240, length 0
16:28:38.325894 IP 138.197.159.178.22 > 99.245.77.102.54274: Flags [P.], seq 51180:51336, ack 1, win 40880, length 156
16:28:38.326120 IP 138.197.159.178.22 > 99.245.77.102.54274: Flags [P.], seq 51336:51596, ack 1, win 40880, length 260
16:28:38.326276 IP 138.197.159.178.22 > 99.245.77.102.54274: Flags [P.], seq 51596:51752, ack 1, win 40880, length 156
16:28:38.326443 IP 138.197.159.178.22 > 99.245.77.102.54274: Flags [P.], seq 51752:51908, ack 1, win 40880, length 156
16:28:38.326533 IP 138.197.159.178.22 > 99.245.77.102.54274: Flags [P.], seq 51908:52064, ack 1, win 40880, length 156
16:28:38.326619 IP 138.197.159.178.22 > 99.245.77.102.54274: Flags [P.], seq 52064:52220, ack 1, win 40880, length 156
16:28:38.326702 IP 138.197.159.178.22 > 99.245.77.102.54274: Flags [P.], seq 52220:52376, ack 1, win 40880, length 156
16:28:38.326791 IP 138.197.159.178.22 > 99.245.77.102.54274: Flags [P.], seq 52376:52532, ack 1, win 40880, length 156
16:28:38.326833 IP 99.245.77.102.54274 > 138.197.159.178.22: Flags [.], ack 49724, win 64084, length 0
16:28:38.326850 IP 99.245.77.102.54274 > 138.197.159.178.22: Flags [.], ack 50192, win 63616, length 0
16:28:38.326965 IP 138.197.159.178.22 > 99.245.77.102.54274: Flags [P.], seq 52532:52896, ack 1, win 40880, length 364
16:28:38.327059 IP 138.197.159.178.22 > 99.245.77.102.54274: Flags [P.], seq 52896:53052, ack 1, win 40880, length 156
16:28:38.327143 IP 138.197.159.178.22 > 99.245.77.102.54274: Flags [P.], seq 53052:53208, ack 1, win 40880, length 156
16:28:38.327227 IP 138.197.159.178.22 > 99.245.77.102.54274: Flags [P.], seq 53208:53364, ack 1, win 40880, length 156
16:28:38.327309 IP 138.197.159.178.22 > 99.245.77.102.54274: Flags [P.], seq 53364:53520, ack 1, win 40880, length 156
16:28:38.327415 IP 138.197.159.178.22 > 99.245.77.102.54274: Flags [P.], seq 53520:53676, ack 1, win 40880, length 156
16:28:38.327502 IP 138.197.159.178.22 > 99.245.77.102.54274: Flags [P.], seq 53676:53832, ack 1, win 40880, length 156
16:28:38.327586 IP 138.197.159.178.22 > 99.245.77.102.54274: Flags [P.], seq 53832:53988, ack 1, win 40880, length 156
16:28:38.331537 IP 99.245.77.102.54274 > 138.197.159.178.22: Flags [.], ack 51180, win 64240, length 0
16:28:38.331601 IP 138.197.159.178.22 > 99.245.77.102.54274: Flags [P.], seq 53988:54144, ack 1, win 40880, length 156
16:28:38.331866 IP 138.197.159.178.22 > 99.245.77.102.54274: Flags [P.], seq 54144:54404, ack 1, win 40880, length 260
16:28:38.332178 IP 138.197.159.178.22 > 99.245.77.102.54274: Flags [P.], seq 54404:54560, ack 1, win 40880, length 156
16:28:38.332305 IP 138.197.159.178.22 > 99.245.77.102.54274: Flags [P.], seq 54560:54716, ack 1, win 40880, length 156
16:28:38.332441 IP 138.197.159.178.22 > 99.245.77.102.54274: Flags [P.], seq 54716:54872, ack 1, win 40880, length 156
16:28:38.337894 IP 99.245.77.102.54274 > 138.197.159.178.22: Flags [.], ack 51908, win 63512, length 0
16:28:38.337978 IP 138.197.159.178.22 > 99.245.77.102.54274: Flags [P.], seq 54872:55028, ack 1, win 40880, length 156
16:28:38.338191 IP 138.197.159.178.22 > 99.245.77.102.54274: Flags [P.], seq 55028:55288, ack 1, win 40880, length 260
16:28:38.338318 IP 138.197.159.178.22 > 99.245.77.102.54274: Flags [P.], seq 55288:55444, ack 1, win 40880, length 156
16:28:38.338427 IP 138.197.159.178.22 > 99.245.77.102.54274: Flags [P.], seq 55444:55600, ack 1, win 40880, length 156
16:28:38.345133 IP 99.245.77.102.54274 > 138.197.159.178.22: Flags [.], ack 53832, win 64240, length 0
16:28:38.345185 IP 138.197.159.178.22 > 99.245.77.102.54274: Flags [P.], seq 55600:55756, ack 1, win 40880, length 156
16:28:38.345416 IP 138.197.159.178.22 > 99.245.77.102.54274: Flags [P.], seq 55756:56016, ack 1, win 40880, length 260
16:28:38.345572 IP 138.197.159.178.22 > 99.245.77.102.54274: Flags [P.], seq 56016:56172, ack 1, win 40880, length 156
16:28:38.345690 IP 138.197.159.178.22 > 99.245.77.102.54274: Flags [P.], seq 56172:56328, ack 1, win 40880, length 156
16:28:38.345794 IP 138.197.159.178.22 > 99.245.77.102.54274: Flags [P.], seq 56328:56484, ack 1, win 40880, length 156
16:28:38.345896 IP 138.197.159.178.22 > 99.245.77.102.54274: Flags [P.], seq 56484:56640, ack 1, win 40880, length 156
16:28:38.346005 IP 138.197.159.178.22 > 99.245.77.102.54274: Flags [P.], seq 56640:56796, ack 1, win 40880, length 156
16:28:38.346114 IP 138.197.159.178.22 > 99.245.77.102.54274: Flags [P.], seq 56796:56952, ack 1, win 40880, length 156
16:28:38.346226 IP 138.197.159.178.22 > 99.245.77.102.54274: Flags [P.], seq 56952:57108, ack 1, win 40880, length 156
16:28:38.346381 IP 138.197.159.178.22 > 99.245.77.102.54274: Flags [P.], seq 57108:57264, ack 1, win 40880, length 156
16:28:38.346546 IP 138.197.159.178.22 > 99.245.77.102.54274: Flags [P.], seq 57264:57420, ack 1, win 40880, length 156
16:28:38.346727 IP 138.197.159.178.22 > 99.245.77.102.54274: Flags [P.], seq 57420:57576, ack 1, win 40880, length 156
16:28:38.351172 IP 99.245.77.102.54274 > 138.197.159.178.22: Flags [.], ack 54144, win 63928, length 0
16:28:38.351221 IP 138.197.159.178.22 > 99.245.77.102.54274: Flags [P.], seq 57576:57732, ack 1, win 40880, length 156
16:28:38.351245 IP 99.245.77.102.54274 > 138.197.159.178.22: Flags [.], ack 55028, win 63044, length 0
16:28:38.351600 IP 138.197.159.178.22 > 99.245.77.102.54274: Flags [P.], seq 57732:58096, ack 1, win 40880, length 364
16:28:38.351736 IP 138.197.159.178.22 > 99.245.77.102.54274: Flags [P.], seq 58096:58252, ack 1, win 40880, length 156
16:28:38.351848 IP 138.197.159.178.22 > 99.245.77.102.54274: Flags [P.], seq 58252:58408, ack 1, win 40880, length 156
16:28:38.352077 IP 138.197.159.178.22 > 99.245.77.102.54274: Flags [P.], seq 58408:58564, ack 1, win 40880, length 156
16:28:38.352267 IP 138.197.159.178.22 > 99.245.77.102.54274: Flags [P.], seq 58564:58720, ack 1, win 40880, length 156
16:28:38.352463 IP 138.197.159.178.22 > 99.245.77.102.54274: Flags [P.], seq 58720:58876, ack 1, win 40880, length 156
16:28:38.389927 IP 99.245.77.102.54274 > 138.197.159.178.22: Flags [P.], seq 1:37, ack 55028, win 63044, length 36
16:28:38.389991 IP 99.245.77.102.54274 > 138.197.159.178.22: Flags [.], ack 55600, win 64240, length 0
16:28:38.390022 IP 138.197.159.178.22 > 99.245.77.102.54274: Flags [P.], seq 58876:59032, ack 37, win 40880, length 156
16:28:38.390308 IP 138.197.159.178.22 > 99.245.77.102.54274: Flags [P.], seq 59032:59412, ack 37, win 40880, length 380
16:28:38.390427 IP 138.197.159.178.22 > 99.245.77.102.54274: Flags [P.], seq 59412:59568, ack 37, win 40880, length 156
16:28:38.404184 IP 99.245.77.102.54274 > 138.197.159.178.22: Flags [.], ack 56952, win 62888, length 0
16:28:38.404242 IP 138.197.159.178.22 > 99.245.77.102.54274: Flags [P.], seq 59568:59724, ack 37, win 40880, length 156
16:28:38.404459 IP 138.197.159.178.22 > 99.245.77.102.54274: Flags [P.], seq 59724:59984, ack 37, win 40880, length 260
16:28:38.404549 IP 138.197.159.178.22 > 99.245.77.102.54274: Flags [P.], seq 59984:60140, ack 37, win 40880, length 156
16:28:38.404641 IP 138.197.159.178.22 > 99.245.77.102.54274: Flags [P.], seq 60140:60296, ack 37, win 40880, length 156
16:28:38.404744 IP 138.197.159.178.22 > 99.245.77.102.54274: Flags [P.], seq 60296:60452, ack 37, win 40880, length 156
16:28:38.404854 IP 138.197.159.178.22 > 99.245.77.102.54274: Flags [P.], seq 60452:60608, ack 37, win 40880, length 156
16:28:38.404943 IP 138.197.159.178.22 > 99.245.77.102.54274: Flags [P.], seq 60608:60764, ack 37, win 40880, length 156
16:28:38.405061 IP 138.197.159.178.22 > 99.245.77.102.54274: Flags [P.], seq 60764:60920, ack 37, win 40880, length 156
16:28:38.405172 IP 138.197.159.178.22 > 99.245.77.102.54274: Flags [P.], seq 60920:61076, ack 37, win 40880, length 156
16:28:38.415347 IP 99.245.77.102.54274 > 138.197.159.178.22: Flags [.], ack 58876, win 64240, length 0
16:28:38.415434 IP 138.197.159.178.22 > 99.245.77.102.54274: Flags [P.], seq 61076:61232, ack 37, win 40880, length 156
16:28:38.415458 IP 99.245.77.102.54274 > 138.197.159.178.22: Flags [.], ack 59724, win 63392, length 0
16:28:38.415707 IP 138.197.159.178.22 > 99.245.77.102.54274: Flags [P.], seq 61232:61596, ack 37, win 40880, length 364
16:28:38.415854 IP 138.197.159.178.22 > 99.245.77.102.54274: Flags [P.], seq 61596:61752, ack 37, win 40880, length 156
16:28:38.416038 IP 138.197.159.178.22 > 99.245.77.102.54274: Flags [P.], seq 61752:61908, ack 37, win 40880, length 156
16:28:38.416156 IP 138.197.159.178.22 > 99.245.77.102.54274: Flags [P.], seq 61908:62064, ack 37, win 40880, length 156
16:28:38.416263 IP 138.197.159.178.22 > 99.245.77.102.54274: Flags [P.], seq 62064:62220, ack 37, win 40880, length 156
16:28:38.416386 IP 138.197.159.178.22 > 99.245.77.102.54274: Flags [P.], seq 62220:62376, ack 37, win 40880, length 156
16:28:38.416515 IP 138.197.159.178.22 > 99.245.77.102.54274: Flags [P.], seq 62376:62532, ack 37, win 40880, length 156
16:28:38.416625 IP 138.197.159.178.22 > 99.245.77.102.54274: Flags [P.], seq 62532:62688, ack 37, win 40880, length 156
16:28:38.416729 IP 138.197.159.178.22 > 99.245.77.102.54274: Flags [P.], seq 62688:62844, ack 37, win 40880, length 156
16:28:38.416832 IP 138.197.159.178.22 > 99.245.77.102.54274: Flags [P.], seq 62844:63000, ack 37, win 40880, length 156
16:28:38.416933 IP 138.197.159.178.22 > 99.245.77.102.54274: Flags [P.], seq 63000:63156, ack 37, win 40880, length 156
16:28:38.417062 IP 138.197.159.178.22 > 99.245.77.102.54274: Flags [P.], seq 63156:63312, ack 37, win 40880, length 156
16:28:38.417220 IP 138.197.159.178.22 > 99.245.77.102.54274: Flags [P.], seq 63312:63468, ack 37, win 40880, length 156
16:28:38.417375 IP 138.197.159.178.22 > 99.245.77.102.54274: Flags [P.], seq 63468:63624, ack 37, win 40880, length 156
16:28:38.421699 IP 99.245.77.102.54274 > 138.197.159.178.22: Flags [.], ack 60608, win 64240, length 0
16:28:38.421750 IP 138.197.159.178.22 > 99.245.77.102.54274: Flags [P.], seq 63624:63780, ack 37, win 40880, length 156
16:28:38.421958 IP 138.197.159.178.22 > 99.245.77.102.54274: Flags [P.], seq 63780:64040, ack 37, win 40880, length 260
16:28:38.422114 IP 138.197.159.178.22 > 99.245.77.102.54274: Flags [P.], seq 64040:64196, ack 37, win 40880, length 156
16:28:38.422222 IP 138.197.159.178.22 > 99.245.77.102.54274: Flags [P.], seq 64196:64352, ack 37, win 40880, length 156
16:28:38.422324 IP 138.197.159.178.22 > 99.245.77.102.54274: Flags [P.], seq 64352:64508, ack 37, win 40880, length 156
16:28:38.422427 IP 138.197.159.178.22 > 99.245.77.102.54274: Flags [P.], seq 64508:64664, ack 37, win 40880, length 156
16:28:38.492058 IP 138.197.159.178.22 > 99.245.77.102.54274: Flags [P.], seq 64664:64820, ack 37, win 40880, length 156
16:28:38.497539 IP 99.245.77.102.54274 > 138.197.159.178.22: Flags [.], ack 61232, win 63616, length 0
16:28:38.497621 IP 138.197.159.178.22 > 99.245.77.102.54274: Flags [P.], seq 64820:64976, ack 37, win 40880, length 156
16:28:38.497657 IP 99.245.77.102.54274 > 138.197.159.178.22: Flags [.], ack 63156, win 64240, length 0
16:28:38.497687 IP 99.245.77.102.54274 > 138.197.159.178.22: Flags [.], ack 64664, win 64240, length 0
16:28:38.498040 IP 138.197.159.178.22 > 99.245.77.102.54274: Flags [P.], seq 64976:65444, ack 37, win 40880, length 468
16:28:38.498276 IP 138.197.159.178.22 > 99.245.77.102.54274: Flags [P.], seq 65444:65600, ack 37, win 40880, length 156
16:28:38.498471 IP 138.197.159.178.22 > 99.245.77.102.54274: Flags [P.], seq 65600:65756, ack 37, win 40880, length 156
16:28:38.498659 IP 138.197.159.178.22 > 99.245.77.102.54274: Flags [P.], seq 65756:65912, ack 37, win 40880, length 156